{
  "schema_version": "1.0",
  "version": "ap-2026.07.1",
  "require_parameter_or_recurrence": true,
  "require_non_judge_criterion": true,
  "require_sensitivity_proof": true,
  "max_steps": 12,
  "prefer_shell_when_applicable": true,
  "notes": [
    "Prefer parameterised shell steps over opaque model calls when the transcript is shell-shaped.",
    "Every reusable draft needs at least one required non-judge criterion with a rejecting sensitivity proof.",
    "Do not invent depends_on edges from transcript order alone."
  ]
}
